### ISSUE TITLE
How to route all traffic?

### ISSUE THREAD

**Issue by movsb** [ivanilves/xiringuito#73]
What I got:

- A VPS server with public IP: 185.186.147.32
- A client that behind a router( router: 192.168.1.1, client: 192.168.1.6)

---

Before run xiringuito:

**server:** 

```sh
$ ifconfig
eth0: flags=4163<UP,BROADCAST,RUNNING,MULTICAST>  mtu 1500
        inet 185.186.147.32  netmask 255.255.254.0  broadcast 185.186.147.255
        inet6 fe80::216:3eff:febd:63fe  prefixlen 64  scopeid 0x20<link>
        ether 00:16:3e:bd:63:fe  txqueuelen 1000  (Ethernet)
        RX packets 34316335  bytes 9003019312 (9.0 GB)
        RX errors 0  dropped 316  overruns 0  frame 0
        TX packets 3428022  bytes 6432490741 (6.4 GB)
        TX errors 0  dropped 0 overruns 0  carrier 0  collisions 0

$ netstat -nr
Kernel IP routing table
Destination     Gateway         Genmask         Flags   MSS Window  irtt Iface
0.0.0.0         185.186.146.1   0.0.0.0         UG        0 0          0 eth0
185.186.146.0   0.0.0.0         255.255.254.0   U         0 0          0 eth0

$ grep Tunnel /etc/ssh/sshd_config
#PermitTunnel no
PermitTunnel yes

$ cat /proc/sys/net/ipv4/ip_forward
1
```

**client:**

```sh
$ ifconfig
eth0: flags=4163<UP,BROADCAST,RUNNING,MULTICAST>  mtu 1500
        inet 192.168.1.6  netmask 255.255.255.0  broadcast 192.168.1.255
        inet6 240e:fa:c4e6:bd00:6e57:1926:976b:661e  prefixlen 64  scopeid 0x0<global>
        inet6 fe80::18f0:9884:88cd:6356  prefixlen 64  scopeid 0x20<link>
        ether dc:a6:32:69:e6:ad  txqueuelen 1000  (Ethernet)
        RX packets 757765657  bytes 205245289 (195.7 MiB)
        RX errors 6  dropped 16  overruns 0  frame 0
        TX packets 1616518854  bytes 4078835038 (3.7 GiB)
        TX errors 0  dropped 0 overruns 0  carrier 0  collisions 0

$ netstat -nr
Kernel IP routing table
Destination     Gateway         Genmask         Flags   MSS Window  irtt Iface
0.0.0.0         192.168.1.1     0.0.0.0         UG        0 0          0 eth0
192.168.1.0     0.0.0.0         255.255.255.0   U         0 0          0 eth0
192.168.1.1     192.168.1.1     255.255.255.255 UGH       0 0          0 eth0
```

---

Running xiringuito:

route server( https://github.com/ivanilves/xiringuito/issues/71#issuecomment-535427023 )

```sh
$ ip route add 185.186.147.32/32 via 192.168.1.1
$ ./xiringuito server 0/0
[ (client) sudo check ]
[ (server) sudo check ]
TUNNEL ID: 29 (local: 29)
SERVER: server
> ROUTE: 0/0

* Will now replace your DNS config with one fetched from the SSH server.
* Set enviromental variable 'NO_DNS', if you do not want this to happen.
--- resolv.conf ---
# Added by xiringuito
nameserver 4.2.2.1
nameserver 4.2.2.2
nameserver 8.8.8.8
--- resolv.conf ---
```

---

After run xiringuito:

**server:**

```sh
$ ifconfig
tun29: flags=4305<UP,POINTOPOINT,RUNNING,NOARP,MULTICAST>  mtu 1500
        inet 192.168.245.114  netmask 255.255.255.255  destination 192.168.245.113
        inet6 fe80::4360:9928:7191:d013  prefixlen 64  scopeid 0x20<link>
        unspec 00-00-00-00-00-00-00-00-00-00-00-00-00-00-00-00  txqueuelen 500  (UNSPEC)
        RX packets 1339  bytes 186997 (186.9 KB)
        RX errors 0  dropped 0  overruns 0  frame 0
        TX packets 234  bytes 19440 (19.4 KB)
        TX errors 0  dropped 0 overruns 0  carrier 0  collisions 0

$ netstat -nr
Kernel IP routing table
Destination     Gateway         Genmask         Flags   MSS Window  irtt Iface
0.0.0.0         185.186.146.1   0.0.0.0         UG        0 0          0 eth0
185.186.146.0   0.0.0.0         255.255.254.0   U         0 0          0 eth0
192.168.245.113 0.0.0.0         255.255.255.255 UH        0 0          0 tun29

$ ping 192.168.245.113
PING 192.168.245.113 (192.168.245.113) 56(84) bytes of data.
64 bytes from 192.168.245.113: icmp_seq=1 ttl=64 time=160 ms
64 bytes from 192.168.245.113: icmp_seq=2 ttl=64 time=161 ms
64 bytes from 192.168.245.113: icmp_seq=3 ttl=64 time=160 ms
^C
--- 192.168.245.113 ping statistics ---
3 packets transmitted, 3 received, 0% packet loss, time 2000ms
rtt min/avg/max/mdev = 160.710/160.892/161.021/0.481 ms
```

**client:**

```sh
$ ifconfig
tun29: flags=4305<UP,POINTOPOINT,RUNNING,NOARP,MULTICAST>  mtu 1500
        inet 192.168.245.113  netmask 255.255.255.255  destination 192.168.245.114
        inet6 fe80::6abb:66e4:746a:bb61  prefixlen 64  scopeid 0x20<link>
        unspec 00-00-00-00-00-00-00-00-00-00-00-00-00-00-00-00  txqueuelen 500  (UNSPEC)
        RX packets 425  bytes 35448 (34.6 KiB)
        RX errors 0  dropped 0  overruns 0  frame 0
        TX packets 1945  bytes 241413 (235.7 KiB)
        TX errors 0  dropped 0 overruns 0  carrier 0  collisions 0

$ netstat -nr
Kernel IP routing table
Destination     Gateway         Genmask         Flags   MSS Window  irtt Iface
0.0.0.0         0.0.0.0         0.0.0.0         U         0 0          0 tun29
0.0.0.0         192.168.1.1     0.0.0.0         UG        0 0          0 eth0
185.186.147.32  192.168.1.1     255.255.255.255 UGH       0 0          0 eth0
192.168.1.0     0.0.0.0         255.255.255.0   U         0 0          0 eth0
192.168.1.1     192.168.1.1     255.255.255.255 UGH       0 0          0 eth0
192.168.245.114 0.0.0.0         255.255.255.255 UH        0 0          0 tun29

$ ping 192.168.245.114
PING 192.168.245.114 (192.168.245.114) 56(84) bytes of data.
64 bytes from 192.168.245.114: icmp_seq=1 ttl=64 time=161 ms
64 bytes from 192.168.245.114: icmp_seq=2 ttl=64 time=160 ms
64 bytes from 192.168.245.114: icmp_seq=3 ttl=64 time=160 ms
^C
--- 192.168.245.114 ping statistics ---
3 packets transmitted, 3 received, 0% packet loss, time 4ms
rtt min/avg/max/mdev = 160.452/160.510/160.600/0.333 ms

$ cat /etc/resolv.conf
# Added by xiringuito
nameserver 4.2.2.1
nameserver 4.2.2.2
nameserver 8.8.8.8
```

---

It seems everything is OK here. But when I curl, it doesn't reply.

```sh
$ curl -v www.google.com
* Expire in 0 ms for 6 (transfer 0x76c880)
* Expire in 1 ms for 1 (transfer 0x76c880)
* Expire in 0 ms for 1 (transfer 0x76c880)
...
```

Thanks for your helping!

**Comment by movsb** [comment]
Thanks! but my problem finally solved.

---

When I ping from my client:

```sh
$ ping 1.1.1.1
PING 1.1.1.1 (1.1.1.1) 56(84) bytes of data.
^C
--- 1.1.1.1 ping statistics ---
388 packets transmitted, 0 received, 100% packet loss, time 854ms
```

I found that all my ICMP packets don't have replies from what I tcpdumpped from my server:

```sh
$ tcpdump -i tun29 host 1.1.1.1
tcpdump: verbose output suppressed, use -v or -vv for full protocol decode
listening on tun29, link-type RAW (Raw IP), capture size 262144 bytes
11:49:27.391412 IP 192.168.245.113 > one.one.one.one: ICMP echo request, id 23226, seq 1, length 64
11:49:28.471464 IP 192.168.245.113 > one.one.one.one: ICMP echo request, id 23226, seq 2, length 64
11:49:29.490787 IP 192.168.245.113 > one.one.one.one: ICMP echo request, id 23226, seq 3, length 64
```

I **got to know that packets from tun29 aren't for my real NIC eth0, they must be dropped by the kernel. So, add some firewall rules do help solve this problem:**

```sh
$ iptables -A FORWARD -i tun29 -j ACCEPT
$ iptables -A FORWARD -o tun29 -j ACCEPT
$ iptables -t nat -A POSTROUTING -o eth0 -j MASQUERADE
```

And now I see those packets get responses:

```sh
$ tcpdump -i tun29 host 1.1.1.1
tcpdump: verbose output suppressed, use -v or -vv for full protocol decode
listening on tun29, link-type RAW (Raw IP), capture size 262144 bytes
11:54:27.260753 IP 192.168.245.113 > one.one.one.one: ICMP echo request, id 25152, seq 1, length 64
11:54:27.261411 IP one.one.one.one > 192.168.245.113: ICMP echo reply, id 25152, seq 1, length 64
11:54:28.261257 IP 192.168.245.113 > one.one.one.one: ICMP echo request, id 25152, seq 2, length 64
11:54:28.261943 IP one.one.one.one > 192.168.245.113: ICMP echo reply, id 25152, seq 2, length 64
11:54:29.262817 IP 192.168.245.113 > one.one.one.one: ICMP echo request, id 25152, seq 3, length 64
11:54:29.263469 IP one.one.one.one > 192.168.245.113: ICMP echo reply, id 25152, seq 3, length 64
```

Thanks! Again!

**Comment by ivanilves** [comment]
Glad you figured it out! :clap: 

Thank you very much for sharing these details as they may help other users as well.
